{
  "releaseId": "sample-dev-001",
  "timestampUtc": "2026-07-14T00:00:00Z",
  "environment": "dev",
  "workspaceId": "00000000-0000-0000-0000-000000000000",
  "sourceBranch": "refs/heads/dev",
  "commit": "0000000000000000000000000000000000000000",
  "riskLevel": "moderate",
  "changeSummary": "Sanitized example: add a backward-compatible notebook transformation.",
  "pipelineRun": "https://dev.azure.com/example/project/_build/results?buildId=1",
  "validations": [
    {
      "name": "artifact-validation",
      "status": "passed",
      "evidence": "Artifact structure and secret scan passed."
    },
    {
      "name": "unit-tests",
      "status": "passed",
      "evidence": "All repository unit tests passed."
    }
  ],
  "approvals": [
    {
      "kind": "fabric-dev",
      "status": "not-required",
      "reference": "Dev environment is configured for automatic synchronization."
    }
  ],
  "fabricOperation": {
    "operationId": null,
    "status": "planned",
    "details": "Example only; no Fabric workspace was called."
  },
  "verification": {
    "status": "pending",
    "checks": [
      {
        "name": "row-count-parity",
        "status": "pending",
        "evidence": "Run against the approved test dataset after synchronization."
      }
    ]
  },
  "recoveryPlan": "Stop promotion, inspect Git status, and use the approved recovery owner."
}
